DOI,Title,Abstract
10.1007/s43681-022-00171-7,Operationalising AI governance through ethics-based auditing: an industry case study,"<jats:title>Abstract</jats:title><jats:p>Ethics-based auditing (EBA) is a structured process whereby an entity’s past or present behaviour is assessed for consistency with moral principles or norms. Recently, EBA has attracted much attention as a governance mechanism that may help to bridge the gap between principles and practice in AI ethics. However, important aspects of EBA—such as the feasibility and effectiveness of different auditing procedures—have yet to be substantiated by empirical research. In this article, we address this knowledge gap by providing insights from a longitudinal industry case study. Over 12 months, we observed and analysed the internal activities of AstraZeneca, a biopharmaceutical company, as it prepared for and underwent an ethics-based AI audit. While previous literature concerning EBA has focussed on proposing or analysing evaluation metrics or visualisation techniques, our findings suggest that the main difficulties large multinational organisations face when conducting EBA mirror classical governance challenges. These include ensuring harmonised standards across decentralised organisations, demarcating the scope of the audit, driving internal communication and change management, and measuring actual outcomes. The case study presented in this article contributes to the existing literature by providing a detailed description of the organisational context in which EBA procedures must be integrated to be feasible and effective.</jats:p>"
10.1007/s43681-024-00495-6,Manipulating Aggregate Societal values to Bias AI Social Choice Ethics,N/A
10.1007/s43681-022-00180-6,"Confucius, cyberpunk and Mr. Science: comparing AI ethics principles between China and the EU",N/A
10.21203/rs.3.rs-4540908/v1,Generative AI in Assessment: AI Detectors and Implications for Practice,"<title>Abstract</title>
        <p>Generative AI has garnered attention as a valuable tool in the field of education. However, educators have expressed concerns about the originality of texts submitted by students as assignments due to the potential use of generative AI in writing tasks. Texts in writing assignments can be categorized into three types: AI-generated, human-written, and mixed texts (a combination of AI-generated and human-written texts). The purpose of the current study is to address some concerns from educators on the detection of the texts submitted by students, i.e., the consistency in detection results and accuracy of the detection results. The subject of the current study was the texts submitted by students as assignments for a graduate course. Four detectors were used to analyze the texts. Our findings provided useful information for educators: 1) Within the same detector, the consistency of the detection results for three types of texts were all above 90%. 2) Among different detectors, the detection results of human-written texts exhibited the highest consistency, whereas mixed texts demonstrated the lowest consistency.3) For accuracy, AI-generated and human-written texts were higher than mixed texts. Implications for educational practice were discussed.</p>"
10.4324/9781003459026-2,AI Literacy,N/A
10.2139/ssrn.4918704,Regulating under Uncertainty: Governance Options for Generative AI,N/A
10.1007/s43681-021-00086-9,Preface,N/A
10.21428/9885764c.16cc139d,The EU AI Act at a crossroads: generative AI as a challenge for regulation,N/A
10.1515/9781501519765-013,Chapter 9: Generative AI Cases and Examples,N/A
10.1016/b978-0-44-321857-6.00002-3,Front Matter,N/A
10.36227/techrxiv.171822467.73136863/v2,Generative AI predicts the Riemann zeta zero distribution,N/A
10.4018/979-8-3693-3278-8.ch004,Innovating Reality,"<jats:p>Generative artificial intelligence has enormous promise in business, marketing, finance, education, and healthcare sectors. It can have an impact on areas like consumer engagement and fraud detection. But it also poses difficult problems. Decision-making is hampered by technological barriers like data quality, explainability, and authenticity, as well as economic issues like income inequality and possible job loss. Privacy, bias, and misuse are all examples of ethical dilemmas. To address these, thorough norms that guarantee accountability, openness, and equity are needed. Meeting societal requirements and fostering collaboration requires advancing AI education and human-centric cooperation. Rules and guidelines that emphasise empathy, clarity, and ethical norms must be established to steer AI research and development toward responsible and ethical practices in order to effectively manage these obstacles.</jats:p>"
10.1007/s43681-021-00087-8,Foreword,N/A
10.36227/techrxiv.171822467.73136863/v3,Generative AI predicts the Riemann zeta zero distribution,N/A
10.31234/osf.io/9yhwz,Techniques for supercharging academic writing with generative AI,"<p>Academic writing is an indispensable yet laborious part of the research enterprise. This article maps out principles and methods for using generative artificial intelligence (AI), specifically large language models (LLMs), to elevate the quality and efficiency of academic writing. It introduces a human–AI collaborative framework that delineates the rationale (“why”), process (“how”), and nature (“what”) of AI engagement in writing. The framework pinpoints both short-term and long-term reasons for engagement, their underlying mechanisms (e.g., cognitive offloading and imaginative stimulation), and the need for a learning mindset to avoid overreliance on AI. It reveals the role of AI throughout the writing process, conceptualized through a two-stage model for human–AI collaborative writing, and the nature of AI assistance in writing, represented through a model of writing-assistance types and levels. Building on this framework, it then describes effective prompting techniques for incorporating AI into the writing routine—outlining, drafting, and editing—as well as strategies for maintaining rigor and adhering to ethics and policies. Ultimately, the prudent integration of AI into academic writing can ease the communication burden, empower authors, accelerate discovery, and promote diversity in science.</p>"
10.14742/apubs.2023.662,Exploring business students’ views of the use of generative AI in assignment writing,"<jats:p>
The rise of generative AI, particularly over the past few years, has raised notable issues about its use. This has been possibly most pronounced in academia, where there has been strong debate on the potential value of generative AI to augment learning outcomes versus the potential for academic dishonesty and devalued education. Whilst some papers have looked at students’ perspectives on the use of generative AI, there has been less focus exploring through what ethical perspectives or frames students see using generative AI in their tertiary education.


We interviewed and conducted focus groups and interviews with students enrolled in an Australian university business school, to explore the ethical frames through which they saw the use of generative AI. Focussing on three specific perspectives: Deontological, Consequentialism and Virtue Ethics, it emerged that no single perspective dominated, with students having a complex mix and latticework of ethical perspectives on its use, even within the same individual. We explore some potential implications for practice that emerged from the data, one of which is the role of the academic as moral exemplar. 
</jats:p>"
10.21275/sr24523234811,Salesforce Einstein GPT: Pioneering Generative AI in CRM Technology,N/A
10.1007/s43681-024-00473-y,Algorithmic evidence in U.S criminal sentencing,N/A
10.1007/s43681-023-00318-0,Navigating fairness measures and trade-offs,"<jats:title>Abstract</jats:title><jats:p>To monitor and prevent bias in AI systems, we can use a wide range of (statistical) fairness measures. However, it is mathematically impossible to optimize all of these measures at the same time. In addition, optimizing a fairness measure often greatly reduces the accuracy of the system (Kozodoi et al., Eur J Oper Res 297:1083–1094, 2022). As a result, we need a substantive theory that informs us how to make these decisions and for what reasons. I show that by using Rawls’ notion of justice as fairness, we can create a basis for navigating fairness measures and the accuracy trade-off. In particular, this leads to a principled choice focusing on both the most vulnerable groups and the type of fairness measure that has the biggest impact on that group. This also helps to close part of the gap between philosophical accounts of distributive justice and the fairness literature that has been observed by (Kuppler et al. Distributive justice and fairness metrics in automated decision-making: How much overlap is there? arXiv preprint <jats:ext-link xmlns:xlink=""http://www.w3.org/1999/xlink"" ext-link-type=""uri"" xlink:href=""http://arxiv.org/abs/2105.01441"">arXiv:2105.01441</jats:ext-link>, 2021), and to operationalise the value of fairness.</jats:p>"
10.21275/sr24703063340,Empowering Patients with AI-Driven Personalized Care: The Transformative Power of Generative AI and Healthcare Data Integration,N/A
10.1007/978-3-031-46238-2_10,Generative Adversarial Network Based Deep Learning Method for Machine Vision Inspection,N/A
10.1007/s43681-024-00458-x,The ethical wisdom of AI developers,"<jats:title>Abstract</jats:title><jats:p>This paper explores ethical wisdom in the artificial intelligence (AI) developer community. Despite robust literature about the need for virtue ethics approaches in AI development, little research has directly engaged with the developer community about their progress in this regard. We have thus conducted semi-structured interviews with a worldwide cohort of 40 developers, which focused on their awareness of ethics issues, how they navigate ethical challenges, and the barriers they encounter in developing ethical wisdom. We find developers are largely aware of the ethical territories they must navigate and the moral dilemmas they personally encounter, but they face limited and inconsistent resources for ethical guidance or training. Furthermore, there are significant barriers inhibiting the development of ethical wisdom in the AI developer community, including the industry’s fixation on innovation, the narrow scope of technical practice, limited provisions for reflection and dialogue, and incentive structures that prioritize profits and prestige. The paper concludes by emphasizing the need to address the gap in domain-specific ethical skill and provides recommendations for organizations, educators, and the AI developer community.</jats:p>"
10.1007/s43681-024-00490-x,Assuring AI safety: fallible knowledge and the Gricean maxims,"<jats:title>Abstract</jats:title><jats:p>In this paper we argue that safety claims, when justified by a safety case, are descriptive fallible knowledge claims. Even if the aim of a safety case was to justify infallible knowledge about the safety of a system, such infallible safety knowledge is impossible to attain in the case of AI-enabled systems. By their nature AI-enabled systems preclude the possibility of obtaining infallible knowledge concerning their safety or lack thereof. We suggest that one can communicate knowledge of an AI-enabled system’s safety by structuring their exchange according to Paul Grice’s Cooperative Principle which can be achieved via adherence to the Gricean maxims of communication. Furthermore, these same maxims can be used to evaluate the calibre of the exchange, with the aim being to ensure that communicating knowledge about an AI-enabled system’s safety is of the highest calibre, in short, that the communication is relevant, of sufficient quantity and quality, and communicated perspicuously. The high calibre communication of safety claims to an epistemically diverse group of stakeholders is vitally important given the increasingly participatory nature of AI-enabled system design, development and assessment.</jats:p>"
10.4324/9781003482918-12,Using generative AI agents for scalable roleplay activities in the health sciences,N/A
10.4324/9781003482918-16,Embracing generative AI in authentic assessment,N/A
10.4018/979-8-3693-1950-5.ch001,Revisiting the Key Components of Creativity Through Generative AI,"<jats:p>Today, advancements in artificial intelligence (AI) and its applications have resulted in its widespread use in creative industries. The goal of this study is to investigate the relationship between artificial intelligence and creativity through the perspective of Generative AI (GenAI) utilized in these industries. To perform this investigation, the study first introduces the concepts of creativity and its key components, along with GenAI and AI creativity. The study's analysis is founded on 14 key components of creativity identified in the previous literature. In the analysis section, the study examines whether these key components are present in today's GenAI tools, drawing on current debates about AI and AI-based applications. Additionally, the capabilities, limitations, and challenges of GenAI are investigated for each key component. In the discussion section, the study makes projections about potential problems that may be encountered when using GenAI and discusses possible redefinitions of key components in the future.</jats:p>"
10.4018/979-8-3693-2418-9.ch014,Transforming Assessments With Generative AI,"<jats:p>The potential of generative AI is evident in every field of life and education is also experiencing a paradigm shift. Generative AI is opening new ways of assessment and the tools that can create engaging and innovative contents. Through the promotion of adaptation and customization, generative AI is positioned to bring about a significant transformation in the educational process. This chapter sheds light on the significance of generative AI in assessment of higher education. It offers valuable insights into the possibilities for change and improvement in the field of educational evaluations, indicating its capacity to revolutionize the future of education.</jats:p>"
10.1007/s43681-024-00475-w,Evaluating approaches for reducing catastrophic risks from AI,"<jats:title>Abstract</jats:title><jats:p>According to a growing number of researchers, AI may pose catastrophic – or even existential – risks to humanity. Catastrophic risks may be taken to be risks of 100 million human deaths, or a similarly bad outcome. I argue that such risks – while contested – are sufficiently likely to demand rigorous discussion of potential societal responses. Subsequently, I propose four desiderata for approaches to the reduction of catastrophic risks from AI. The quality of such approaches can be assessed by their chance of success, degree of beneficence, degree of non-maleficence, and beneficent side effects. Then, I employ these desiderata to evaluate the promises, limitations and risks of alignment research, timelines research, policy research, halting or slowing down AI research, and compute governance for tackling catastrophic AI risks. While more research is needed, this investigation shows that several approaches for dealing with catastrophic AI risks are available, and where their respective strengths and weaknesses lie. It turns out that many approaches are complementary and that the approaches have a nuanced relationship to approaches to present AI harms. While some approaches are similarly useful for addressing catastrophic risks and present harms, this is not always the case.</jats:p>"
10.1007/s43681-024-00423-8,How AI hype impacts the LGBTQ + community,"<jats:title>Abstract</jats:title><jats:p>Hype around Artificial Intelligence (AI) has been a feature of this technology since its inception. However, the most recent wave of AI hype has been leveraged to encourage adoption of AI technologies that cause issues for marginalised communities. Hype is also a means to obfuscate real issues of bias, harm, and exploitation felt most sharply by marginalised communities when AI is implemented. This therefore raises the question of power imbalances as a feature of AI technologies as we currently know them. This paper will study the relationship of AI hype and marginalised communities, with particular emphasis on the LGBTQ + community, and look at the way that AI impacts on this community. This paper will pose two key questions: does hype affect marginalised communities, particularly hype around new technologies such as AI; and what impact does the LGBTQ + community experience as a result of hype. This paper will then move on to discuss areas that provide a focus for discourse of AI hype and the impact on the LGBTQ + community: policy and decision-making, the maintenance of the cisgender heteronormative (cishet) baseline, the ubiquity of a mythology of AI, and the role of market expansion.</jats:p>"
10.1117/12.3009202.13bde57c-0346-ee11-a99c-00505691c5e1,N/A,N/A
10.36227/techrxiv.171822467.73136863/v1,Generative AI predicts the Riemann zeta zero distribution,"<jats:p id=""p1"">The Transformer architecture of Generative AI is very successful in
predicting the distribution of Riemann zeta zero counts on consecutive
Gram intervals. We get accuracies of 0.998 in predicting a sequence of
ten consecutive zero counts. We tested with two ranges of Riemann zeta
zeros, t = 10^12 and t = 10^28. With special training for rare
events, we can get essentially full prediction. This shows that applying
the technique to more complex problems has great promise. We have used
very minimal computer resources compared to typical models in language
applications. With access to better resources, we can attack much more
important problems.</jats:p>"
10.4018/979-8-3693-0074-9.ch002,Unleashing the Potential,"<jats:p>Generative artificial intelligence, anchored by large language models (LLMs), is significantly altering the educational landscape. This chapter examines the impact of generative AI on education, illustrating its capability to create personalized content and transform learning environments. Despite concerns over academic dishonesty facilitated by LLMs, the chapter argues against a regressive stance and advocates for the constructive integration of AI into educational practices. By drawing on theories of learning, the chapter elucidates the pedagogical implications of generative AI and describes specific use cases in language learning, computer science, and mathematics. Highlighting both the potential and limitations of this emerging technology, the chapter posits that generative AI is not merely a disruptive force, but a revolutionary tool poised to redefine the methodologies of teaching and learning.</jats:p>"
10.4018/979-8-3693-3278-8.ch003,Navigating Uncharted Waters,"<jats:p>This chapter explores the evolution and future trajectory of Python-driven generative AI, highlighting Python's role in advancing this technology. It discusses the integration of Python with emerging technologies like neuromorphic computing and reinforcement learning, focusing on their potential to revolutionize art, design, and media. Through detailed analysis of the open-source implementation of a technology platform designed, the chapter provides insights into Python's facilitation of innovative AI applications. It addresses potential challenges and ethical considerations, along with the mitigation and call to action, emphasizing the importance of responsible innovation. The narrative underscores Python's influence in making advanced AI technologies accessible and scalable, preparing readers to engage with future developments in the field of generative AI.</jats:p>"
10.5220/0012729800003717,Generative AI Risk Management in Digital Economy,N/A
10.1007/s43681-021-00047-2,"Community-in-the-loop: towards pluralistic value creation in AI, or—why AI needs business ethics","<jats:title>Abstract</jats:title><jats:p>Today, due to growing computing power and the increasing availability of high-quality datasets, artificial intelligence (AI) technologies are entering many areas of our everyday life. Thereby, however, significant ethical concerns arise, including issues of fairness, privacy and human autonomy. By aggregating current concerns and criticisms, we identify five crucial shortcomings of the current debate on the ethics of AI. On the threshold of a third wave of AI ethics, we find that the field eventually fails to take sufficient account of the business context and deep societal value conflicts the use of AI systems may evoke. For even a perfectly fair AI system, regardless of its feasibility, may be ethically problematic, a too narrow focus on the ethical implications of technical systems alone seems insufficient. Therefore, we introduce a business ethics perspective based on the normative theory of contractualism and conceptualise ethical implications as conflicts between values of diverse stakeholders. We argue that such value conflicts can be resolved by an account of deliberative order ethics holding that stakeholders of an economic community deliberate the costs and benefits and agree on rules for acceptable trade-offs when AI systems are employed. This allows AI ethics to consider business practices, to recognise the role of firms, and ethical AI not being at risk to provide a competitive disadvantage or in conflict with the current functioning of economic markets. By introducing deliberative order ethics, we thus seek to do justice to the fundamental normative and political dimensions at the core of AI ethics.</jats:p>"
10.1007/s43681-023-00355-9,Scoring AI-generated policy recommendations with Risk-Adjusted Gain in Net Present Happiness,"<jats:title>Abstract</jats:title><jats:p>Ethical considerations for assessing the collective benefit of an AI’s policy recommendations are different from assessing the ethical consequences from interacting with an individual. The study of population ethics provides a framework for studying collective benefit or harm in abstract terms. Research into happiness has made significant strides in identifying some key drivers of subjective well-being as measured both individually and collectively across societies. This research examines models from population ethics and statistical studies of subjective well-being to create a measure of benefit with which to judge AI recommendations. These models include refining estimations of the interaction between cultural aspects and economic development and incorporating measures of inequality of happiness and satisfaction through a society. When the impacts of a proposed policy are simulated for multiple successive years, risk discounting is used to measure Net Present Happiness, thus solving the conundrum of considering future generations in ethical considerations as posed in population ethics. Lastly, the Risk-Adjusted Gain in Net Present Happiness is proposed as a reasonable approach to ranking AI policy recommendations and as an AI objective function.</jats:p>"
10.1007/s43681-022-00241-w,Making sense of the conceptual nonsense ‘trustworthy AI’,N/A
10.1007/s43681-024-00512-8,Command responsibility in military AI contexts: balancing theory and practicality,"<jats:title>Abstract</jats:title><jats:p>Artificial intelligence (AI) has found extensive applications to varying degrees across diverse domains, including the possibility of using it within military contexts for making decisions that can have moral consequences. A recurring challenge in this area concerns the allocation of moral responsibility in the case of negative AI-induced outcomes. Some scholars posit the existence of an insurmountable “responsibility gap”, wherein neither the AI system nor the human agents involved can or should be held responsible. Conversely, other scholars dispute the presence of such gaps or propose potential solutions. One solution that frequently emerges in the literature on AI ethics is the concept of command responsibility, wherein human agents may be held responsible because they perform a supervisory role over the (subordinate) AI. In the article we examine the compatibility of command responsibility in light of recent empirical studies and psychological evidence, aiming to anchor discussions in empirical realities rather than relying exclusively on normative arguments. Our argument can be succinctly summarized as follows: (1) while the theoretical foundation of command responsibility appears robust (2) its practical implementation raises significant concerns, (3) yet these concerns alone should not entirely preclude its application (4) they underscore the importance of considering and integrating empirical evidence into ethical discussions.</jats:p>"
