DOI,Title,Abstract
10.4018/979-8-3693-3278-8.ch001,A Comprehensive Survey of Hypermedia System for Text- to-Image Conversion Using Generative AI,"<jats:p>The intersection of computer vision and natural language processing (NLP) has witnessed significant advancements in recent research, particularly in the realm of converting text into meaningful images leveraging generative AI and large language models. This review work aims to comprehensively review the progress made in text-to-image conversion. The survey covers the three primary approaches in the field, namely diffusion models (DM), GAN model approaches, and autoregressive approaches. Furthermore, the authors present a comprehensive chronology of the TIG journey, encompassing its origin and the most recent developments, providing readers with a comprehensive perspective on the field's progression. The survey focuses heavily on identifying the existing constraints of DM in picture production and offers multiple research publications and their contributions in overcoming these constraints. The survey provides useful insights into the advancements in text-to-image (TIG) generation using generative AI by focusing on key difficulties and examining how different works have addressed them.</jats:p>"
10.4018/979-8-3693-2418-9.ch007,Generative AI and Its Implications for Higher Education Students' Creativity,"<jats:p>This chapter explores Generative AI (artificial intelligence) in higher education regarding students' creativity. By utilising the quantitative content analysis approach, the chapter explored the impact of generative AI in higher education to understand its transformative effects on students' creative thinking processes and its outcomes. Current literature reveals the latest thinking on how AI enables or disrupts students' creativity. Generative AI is a potent tool in higher education which generates original content like text, images, music, and videos based on input data or predefined models. The adoption of generative AI led to the need to understand how these advancements may shape the educational experience to develop essential skills like creativity. Since creativity is crucial in today's digital age, generative AI raises questions about its potential impact on the imagination. The aspect of creativity, which is fundamental in higher education, offers students opportunities to enhance critical-thinking, problem-solving, and innovation; however, a balance is necessary between the utilisation of AI tools and the human element of creativity.</jats:p>"
10.20944/preprints202407.1437.v1,Integrating Multimodal Generative AI and Blockchain for Enhancing Generative Design in the Early Phase of Architectural Design Process,"<jats:p>AI advances integrate generative design tools in architecture, providing architects with sophisticated design options. It enables the creation of intricate, high-performing projects by exploring diverse design possibilities with AI and algorithms. Generative AI and generative design empower architects to create better-performing, sustainable, and efficient design solutions and explore diverse design possibilities. This paper leverages multimodal generative AI to enhance design creativity by combining textual and visual inputs. Blockchain technology converts design metadata into NFTs, ensuring secure, authentic, and traceable data storage. The framework addresses data ownership, legal adherence, and client-architect collaboration and is entirely scalable for digital design authentication. This research exemplifies the pragmatic fusion of Generative AI and blockchain technology applied in architectural design for more transparent, secure, and effective results. This study provides a strategy that uses generative AI technologies to achieve an efficient and creative workflow in the early stages of architectural design.</jats:p>"
10.4018/979-8-3693-1565-1.ch013,Sustainable Islamic Financial Inclusion,"<jats:p>The study investigates the convergence of digital transformation, artificial intelligence (AI), and Islamic finance. In particular, it examines the ethical consequences that may arise from the integration of Generative AI in the sustainable development of Islamic financial services and products. This research fills a void in the current body of knowledge by examining the ethical consequences of generative AI in the context of Islamic finance. Using an interdisciplinary framework that integrates Islamic finance and technological ethics, the study seeks to make scientific and practical contributions. At the intersection of AI technology and Islamic finance, it is anticipated that new theories will emerge, as well as ethical principles that will serve as a guide for technology developers, policymakers, and Islamic financial institutions. The study has the potential to lead in creating a sustainable and inclusive Islamic finance ecosystem by ethically integrating Generative AI.</jats:p>"
10.4018/979-8-3693-1351-0.ch013,Revolutionizing Content Creation and Curriculum Development Through Generative AI,"<jats:p>AI can generate and provide customized, inclusive, and engaging learning experiences. This chapter emphasizes the collaborative partnership between human educators and AI systems, highlighting its crucial role in maximizing AI's potential. Educators provide context and guidance through adaptive learning platforms, AI-powered feedback, and AI-enhanced content creation to ensure students receive a personalized, contextually relevant education. Human knowledge, including pedagogical insight and ethical considerations, complements the capabilities of artificial intelligence. AI promises personalized perpetual learning, enhanced accessibility, and dynamic curriculum design in the future. This vision of collaboration promotes critical thinking, problem-solving, and inclusiveness. Educators, institutions, policymakers, and AI developers must ensure that education remains empowering, inclusive, and excellent for AI to be integrated responsibly. By embracing this partnership, education becomes more accessible, individualized, and influential.</jats:p>"
10.1007/s43681-023-00330-4,Ethics by design for artificial intelligence,"<jats:title>Abstract</jats:title><jats:p>In this paper, we present an approach for the systematic and comprehensive inclusion of ethical considerations in the design and development process of artificial intelligence systems, called Ethics by Design for AI (EbD-AI). The approach is the result of a three-year long research effort, and has recently be adopted by the European Commission as part of its ethics review procedure for AI projects. We describe and explain the approach and its different components and its application to the development of AI software and systems. We also compare it to other approaches in AI ethics, and we consider limitations of the approach as well as potential criticisms.</jats:p>"
10.1007/s43681-021-00045-4,On formal ethics versus inclusive moral deliberation,"<jats:title>Abstract</jats:title><jats:p>In this article, I will advocate caution against a formalization of ethics by showing that it may produce and perpetuate unjustified power imbalances, disadvantaging those without a proper command of the formalisms, and those not in a position to decide on the formalisms’ use. My focus rests mostly on ethics formalized for the purpose of implementing ethical evaluations in computer science–artificial intelligence, in particular—but partly also extends to the project of applying mathematical rigor to moral argumentation with no direct intention to automate moral deliberation. Formal ethics of the latter kind can, however, also be seen as a facilitator of automated ethical evaluation. I will argue that either form of formal ethics presents an obstacle to inclusive and fair processes for arriving at a society-wide moral consensus. This impediment to inclusive moral deliberation may prevent a significant portion of society from acquiring a deeper understanding of moral issues. However, I will defend the view that such understanding supports genuine and sustained moral progress. From this, it follows that formal ethics is not per se supportive of moral progress. I will illustrate these arguments by practical examples of manifest asymmetric relationships of power primarily from the domain of autonomous vehicles as well as on more visionary concepts, such as artificial moral advisors. As a result, I will show that in these particular proposed use-cases of formal ethics, machine ethics risks to run contrary to their proponents’ proclaimed promises of increasing the rigor of moral deliberation and even improving human morality on the whole. Instead, I will propose that inclusive discourse about automating ethical evaluations, e.g., in autonomous vehicles, should be conducted with unrelenting transparency about the limitations of implementations of ethics. As an outlook, I will briefly discuss uses formal ethics that are more likely to avoid discrepancies between the ideal of inclusion and the challenge from power asymmetries.Please check and confirm that the authors and their respective affiliations have been correctly identified and amend if necessary.I confirm.Author names: Please confirm if the author names are presented accurately and in the correct sequence (given name, middle name/initial, family name). I confirm. Kindly check and confirm the country name for the affiliation [1] is correct.I confirm.</jats:p>"
10.1007/s43681-024-00563-x,The rise of checkbox AI ethics: a review,"<jats:title>Abstract</jats:title><jats:p>The rapid advancement of artificial intelligence (AI) sparked the development of principles and guidelines for ethical AI by a broad set of actors. Given the high-level nature of these principles, stakeholders seek practical guidance for their implementation in the development, deployment and use of AI, fueling the growth of practical approaches for ethical AI. This paper reviews, synthesizes and assesses current practical approaches for AI in health, examining their scope and potential to aid organizations in adopting ethical standards. We performed a scoping review of existing reviews in accordance with the PRISMA extension for scoping reviews (PRISMA-ScR), systematically searching databases and the web between February and May 2023. A total of 4284 documents were identified, of which 17 were included in the final analysis. Content analysis was performed on the final sample. We identified a highly heterogeneous ecosystem of approaches and a diverse use of terminology, a higher prevalence of approaches for certain stages of the AI lifecycle, reflecting the dominance of specific stakeholder groups in their development, and several barriers to the adoption of approaches. These findings underscore the necessity of a nuanced understanding of the implementation context for these approaches and that no one-size-fits-all approach exists for ethical AI. While common terminology is needed, this should not come at the cost of pluralism in available approaches. As governments signal interest in and develop practical approaches, significant effort remains to guarantee their validity, reliability, and efficacy as tools for governance across the AI lifecycle.</jats:p>"
10.1007/s43681-023-00306-4,"On educating ethics in the AI era: why business schools need to move beyond digital upskilling, towards ethical upskilling",N/A
10.1007/s43681-023-00295-4,"If conceptual engineering is a new method in the ethics of AI, what method is it exactly?","<jats:title>Abstract</jats:title><jats:p>Can a machine be a person? Can a robot think, be our friend or colleague? These familiar questions in the ethics of AI have recently become much more urgent than many philosophers anticipated. However, they also seem as intractable as ever. For this reason, several philosophers of AI have recently turned their attention to an arguably new method: <jats:italic>conceptual engineering</jats:italic>. The idea is to stop searching for the real essence of <jats:italic>friendship</jats:italic> or our ordinary concept of the person. Instead, ethicists of AI should engineer concepts of friend or person we <jats:italic>should</jats:italic> apply. But what exactly is this method? There is currently no consensus on what the target object of conceptual engineers is or should be. In this paper, I reject a number of popular options and then argue for a pragmatist way of thinking about the target object of conceptual engineering in the ethics of AI. I conclude that in this pragmatist picture, conceptual engineering is probably what we have been doing all along. So, is it all just hype? No, the idea that the ethics of AI has been dominated by conceptual engineers all along constitutes an important meta-philosophical insight. We can build on this insight to develop a more rigorous and thorough methodology in the ethics of AI.</jats:p>"
10.1007/s43681-021-00091-y,Coarse ethics: how to ethically assess explainable artificial intelligence,"<jats:title>Abstract</jats:title><jats:p>The integration of artificial intelligence (AI) into human society mandates that their decision-making process is explicable to users, as exemplified in Asimov’s Three Laws of Robotics. Such human interpretability calls for explainable AI (XAI), of which this paper cites various models. However, the transaction between computable accuracy and human interpretability can be a trade-off, requiring answers to questions about the negotiable conditions and the degrees of AI prediction accuracy that may be sacrificed to enable user-interpretability. The extant research has focussed on technical issues, but it is also desirable to apply a branch of ethics to deal with the trade-off problem. This scholarly domain is labelled<jats:italic>coarse ethics</jats:italic>in this study, which discusses two issues vis-à-vis AI prediction as a type of evaluation. First, which formal conditions would allow trade-offs? The study posits two minimal requisites: adequately high coverage and order-preservation. The second issue concerns conditions that could justify the trade-off between computable accuracy and human interpretability, to which the study suggests two justification methods: impracticability and adjustment of perspective from machine-computable to human-interpretable. This study contributes by connecting ethics to autonomous systems for future regulation by formally assessing the adequacy of AI rationales.</jats:p>"
10.69554/jiuo9062,Business value of Generative AI use cases,"<jats:p xml:lang=""en"">This paper discusses the significant impact of artificial intelligence (AI), specifically generative AI (GenAI), on various industries and business processes. It highlights the rapid adoption of AI technologies and their profound influence on global business operations. The paper shares views on the substantial growth rate for the technology, with many businesses already in piloting phases or production stages. It emphasises the transformative role of generative AI in creating new services and products, necessitating changes in operating models, technology stacks and workforce skills. The paper also touches on various industries affected by AI, the potential for automation and augmentation and the strategic planning required for businesses to effectively implement and benefit from these technologies. Additionally, it discusses the importance of responsible AI, addressing risks such as bias and privacy, and complying with emerging regulations. The paper highlights the crucial role of AI in modernising business practices and creating competitive advantages in various sectors.</jats:p>"
10.2139/ssrn.4904004,Corporate Responses to Generative AI: Early Evidence from Investment Efficiency,N/A
10.5194/egusphere-egu24-15392,The Potential of Generative AI for the Urban Water Sector,"<jats:p>The urban water sector is increasingly turning to AI and deep learning to address the complex challenges posed by growing demographics, climate change, and urbanization. Despite the pressing need, this sector has been relatively slow in adopting these technologies compared to others, primarily due to its conservative nature. However, the recent advancements in generative AI have opened new frontiers for innovation, presenting a crucial opportunity for the urban water sector to accelerate its technological evolution. Expected regulations, particularly from institutions like the European Union, should not be viewed as a hindrance but as a catalyst for enhanced collaboration between academia, industry, and public stakeholders. Such collaboration is essential to finally push the development and adoption of reliable and safe AI systems, ensuring alignment with regulatory frameworks.
In this work, we first provide an overview of the latest trends in generative AI, focusing on how Large Language Models and Large Multimodal Models can benefit the urban water sector. Particularly, Large Multimodal Models can offer an added layer of explainability to predictive models working on imagery or other sensor data, a highly desirable feature for applications related to critical infrastructure. By literally asking these models to explain their decision-making processes with respect to the processed data streams, we can partially demystify the 'black box' nature of AI systems.
This potential is highlighted for a case study on sewer defect detection, utilizing a Large Multimodal Model that processes both text and imagery. The predictive results on the publicly available SewerML dataset are encouraging with respect to existing deep learning methods. More importantly, we show that explanations provided by the Large Multimodal Model can enlighten the decision-making process, making it more transparent. This added layer of explanation offers valuable insights and may set a new trajectory for developing trustworthy AI methodologies in critical water infrastructure management.</jats:p>"
10.21428/8c225f6e.0390b853,Issue 4.1 Generative AI and education,N/A
10.1007/s43681-023-00334-0,Moderating the effects of “surveillance capitalism”: an Aristotelian perspective,N/A
10.1007/s43681-023-00296-3,Artificial intelligence’s right to life,"<jats:title>Abstract</jats:title><jats:p>The right to life is fundamental and primary and is a precondition for exercising other rights (Ramcharan in Ramcharan (ed), The right to life in International Law, Martinus Nijhoff Publishers, Dordrecht, 1985). Its universal recognition in the arena of international law is associated with the concept of a human being endowed with inherent and inalienable dignity. Categorization of the circle of entities covered with the right to life today seems obvious and indisputable. Intense development of artificial intelligence, also the fact that it has passed the Turing test which checks AI’s thinking ability in a way similar to human reasoning, inspires a reflection on AI’s future legal status. This study will investigate a thesis of whether artificial intelligence may be entitled to the right to life. The analysis will be carried out around an exploratory question: what are the requirements for being afforded protection of the right to life?</jats:p>"
10.47289/aiej20201214,What a Philosopher Learned at an AI Ethics Evaluation,"<jats:p>AI ethics increasingly focuses on converting abstract principles into practical action. This case study documents nine lessons for the conversion learned while performing an ethics evaluation on a deployed AI medical device. The utilized ethical principles were adopted from the Ethics Guidelines for Trustworthy AI, and the conversion into practical insights and recommendations was accomplished by an independent team composed of philosophers, technical and medical experts.</jats:p>"
10.1007/s43681-023-00304-6,The Kant-inspired indirect argument for non-sentient robot rights,N/A
10.1515/9781501518447-008,Chapter 7: Generative AI and Human Speech,N/A
10.1201/9781032656618-3,The Core and Ecosystem of Generative AI,N/A
10.4018/979-8-3693-0487-7.ch007,Exploring the Potential of Generative AI in English Language Teaching,"<jats:p>Integrating artificial intelligence (AI) technologies in education has shown remarkable potential in revolutionizing various aspects of teaching and learning. In English language teaching (ELT), generative AI has emerged as a powerful tool to enhance language acquisition, foster learner engagement, and provide personalized instruction. While the potential of generative AI in ELT is promising, it is important to provide insights into certain challenges and considerations. Ethical concerns related to data privacy, bias in AI algorithms, and the potential displacement of human instructors need to be carefully navigated. The successful implementation of generative AI in ELT relies on careful consideration of ethical implications, human oversight, and the continuous refinement of AI algorithms to ensure optimal language learning outcomes. On these premises, this chapter explores the potential of generative AI in ELT and its implications for language learners and educators.</jats:p>"
10.7315/cde.2023.514,Generative AI for Automated Urban Housing Floor Plan Generation,N/A
10.5220/0012736200003708,Generative AI for Productivity in Industry and Education,N/A
10.4018/979-8-3693-2440-0.ch025,Impact of Generative AI in Education 2030,"<jats:p>This book chapter contains the basics of generative AI, evaluation of generative AI, working process of generative AI, and applications of generative AI in Education 2030. In this chapter, the authors will introduce the emerging concept of large language model (LLM), reinforcement learning, response generation, neural network, and tokenization as the building blocks of generative AI. In this context, the authors will analyze the role of AI based ChatGpt technology in Education. The applications of generative AI in educational policy making, infrastructure development, research, innovation, activity building, and content generation for the students at schools and colleges will be discussed. But the contents of above mentioned activities must be guided by a teacher of school and college because such contents have more context wise decision making abilities rather than AI based solutions.</jats:p>"
10.70179/grdjev09i100002,Transforming Car Manufacturing: How Generative AI and Machine Learning Are Revolutionizing Production,"<jats:p>The Daimler AG trains Generative Adversarial Network (GAN) to grow the data-confirmed neural networks. The ultimate goal is a production-oriented application that enables faster manufacturing, improved quality, and a more efficient use of resources through a higher level of automation. The success of deep learning-based methods, particularly Generative Adversarial Networks (GANs), has led to new opportunities in generative AI in the manufacturing domain. In a proof of concept, we use a face generator as a metaphor for the generation of complex workpiece surfaces. The GAN transforms a low-resolution surface map - the so-called latent vector - into a high-resolution area on the generated face surface. This is used for the manufacturing of a corresponding face in an automotive body shop. The method is based on a label-to-attribute setup and includes a pre-fitting step for control point generation.</jats:p>"
10.21275/sr24728192241,Innovative Approaches to Payment Glossary Creation and Management Using Generative AI,N/A
10.1007/979-8-8688-0403-8_5,Large Language Models,N/A
10.1007/978-3-031-46238-2_4,Privacy in Generative Models: Attacks and Defense Mechanisms,N/A
10.1007/s43681-023-00326-0,"Algorithmic indirect discrimination, fairness and harm",N/A
10.69554/auij4734,Measuring the business value of generative AI,"<jats:p xml:lang=""en"">Generative artificial intelligence (GenAI) can deliver tangible and intangible values that can be calculated to decide which projects benefit from GenAI and which do not. This paper is intended to be a guide for businesses just starting to build traction for their ideas. The focus is on evaluating and leveraging GenAI’s potential to innovate faster and compete effectively in a rapidly evolving digital economy. The paper specifies the many ways GenAI can have an impact on a business and considers how to measure that impact. It starts with standard business metrics (revenue, profit, customer satisfaction, etc.) and then turns to the more esoteric task of measuring the impact on creativity, inspiration and innovation, followed by business disruption and process metrics. It finishes with a look at improving process improvement.</jats:p>"
10.69732/ahcn5851,Grounding AI: Understanding the Implications of Generative AI in World Language &amp; Culture Education,N/A
