DOI,Title,Abstract
10.36227/techrxiv.24045792,"Exploring the Synergy between Generative AI, Data and Analytics in the Modern Age","<jats:p>&lt;p&gt;In the year 2023, a heightened sense of curiosity and apprehension pervaded the landscape of generative artificial intelligence (AI), particularly in the wake of the unveiling of the ChatGPT product by OpenAI. This pivotal moment sparked a flurry of discussions that predominantly revolved around the role of data in shaping the trajectory of generative AI. As researchers and organizations alike delved into this innovative realm, a pronounced inclination toward investigating its potential applications emerged. Notably, organizations swiftly recognized the transformative potential of generative AI in bolstering productivity across various sectors.&lt;/p&gt;
&lt;p&gt;At the heart of these deliberations lies the profound significance of data. With data as the focal point, a compelling exploration began to unfold, with researchers keenly scrutinizing the ramifications of integrating generative AI within the domain of data and analytics. This research initiative was driven by an intrinsic desire to uncover the ways in which generative AI could be harnessed to enhance and streamline analytical processes.&lt;/p&gt;
&lt;p&gt;In this context, the present research undertook a comprehensive investigation, employing a multifaceted approach. Leveraging various social media platforms as a primary source of insights, the research embarked on a journey to discern the prevailing sentiments, concerns, and expectations surrounding generative AI tools. This was further complemented by the execution of proof-of-concept (POC) endeavors, which not only enabled hands-on experience with generative AI tools but also facilitated a nuanced comprehension of their practical implications.&lt;/p&gt;
&lt;p&gt;The culmination of these efforts yielded a series of noteworthy findings. Principally, it was discerned that enterprises stand to gain substantial benefits from embracing the capabilities of generative AI within the domain of data and analytics. The integration of generative AI tools offers the potential to revolutionize productivity, propelling organizations toward novel insights and expediting analytical processes. Concurrently, a strategic partnership with generative AI entities emerged as a salient consideration for safeguarding intellectual properties. Collaborative engagements between companies and generative AI providers became imperative to navigate the evolving landscape of data-driven innovation.&lt;/p&gt;
&lt;p&gt;In conclusion, the year 2023 ushered in a period marked by intense curiosity and apprehension surrounding generative AI, catalyzed by the introduction of ChatGPT and its ensuing discussions. The centrality of data within this discourse propelled researchers and organizations toward an exploration of generative AI's potential applications, notably in the realm of data and analytics. Through a comprehensive research endeavor encompassing social media insights, POC experimentation, and practical insights, it became evident that the integration of generative AI could usher in transformative enhancements to productivity and analytical processes. In parallel, collaborative endeavors with generative AI entities emerged as a strategic imperative, offering a dual advantage of innovation and intellectual property protection. This research underscores the compelling need for enterprises to harness generative AI's capabilities, thereby positioning themselves at the vanguard of data-driven progress.&lt;/p&gt;</jats:p>"
10.4324/9781003459026,Generative AI in Higher Education,N/A
10.1007/s00146-024-01872-9,What to consider before incorporating generative AI into schools?,N/A
10.2139/ssrn.4682872,This is Not Global AI: International Reports on AI as Vehicles of Colonialism in the Age of Generative AI,N/A
10.1007/978-3-031-46238-2_17,Underwater Acoustic Noise Modeling Based on Generative-Adversarial-Network,N/A
10.4324/9781003074991-24,Why Ethics is a High Hurdle for AI,N/A
10.21275/sr24517073623,Reinforcing Cyber Defense: Generative AI Powered Intelligent Agent Architecture for Enhanced Security Operations,N/A
10.4018/979-8-3693-2440-0.ch019,Role of Video Content Generation in Education Systems Using Generative AI,"<jats:p>This chapter delves into the transformative potential of three cutting-edge models, i.e., CCVS, DreamPose, and Fast Vid2Vid, in reshaping educational video content creation. CCVS, a dynamic framework amalgamating generative and discriminative models, excels in synthesizing high-quality videos from text descriptions. Its versatility in video generation, interpolation, and prediction marks a paradigm shift in educational content development. DreamPose, an advanced AI system leveraging stable diffusion, translates textual descriptions into visually stunning fashion videos. Its user-friendly design caters to diverse fashion styles, making it an ideal tool for educators seeking visually engaging content across disciplines. Fast Vid2Vid, a deep learning model, takes the spotlight for efficiently generating high-quality videos from a single image. Recognized for its realism, it holds promise in dynamic visualizations for educational purposes, spanning virtual and augmented reality experiences. Practical insights and implementation strategies empower educators to seamlessly integrate these models into educational settings, offering a comprehensive guide from planning and scripting to interactive element incorporation. This chapter lays the foundation for educators and content creators to elevate the educational experience through innovative visual storytelling and AI-driven technologies.</jats:p>"
10.1109/icws60048.2023.00103,"Empowering Generative AI with Knowledge Base 4.0: Towards Linking Analytical, Cognitive, and Generative Intelligence",N/A
10.36227/techrxiv.24087534,Synergy in Technology How Generative AI Augments the Capabilities of Customer Data Platforms,"<jats:p>&lt;p&gt;In an era marked by data-driven decision-making, Customer Data Platforms (CDPs) have emerged as pivotal tools for aggregating and analyzing customer data. However, as these platforms grapple with increasingly complex data sets and real-time customer engagement demands, there is a pressing need for more advanced, scalable solutions. This study explores the synergy between Generative Artificial Intelligence (AI) and CDPs, aiming to understand how the integration of generative algorithms can augment the capabilities of these platforms. Employing a multi-method research approach, including case studies, empirical analyses, and expert interviews, this paper investigates various applications of Generative AI within CDPs, such as data augmentation, real-time decision-making, and customer personalization. Moreover, the ethical implications of using generative algorithms, especially concerning data privacy and security, are critically examined. The study reveals that Generative AI can significantly enhance the functionality, performance, and efficiency of CDPs while also posing new questions around ethical considerations. Our findings offer invaluable insights for businesses, marketers, and technologists seeking to leverage the synergistic potential of these two advanced technological paradigms. &lt;/p&gt;</jats:p>"
10.22541/essoar.170034944.42344050/v1,Nowcasting Earthquakes with QuakeGPT An AI-Enhanced Earthquake Generative Pretrained Transformer,N/A
10.31219/osf.io/btczf,Leveraging generative AI to acculturate away from climate apathy,"<p>“Throw away anything that sounds too complicated. Only keep what is simple to grasp. Keep whatever news that seems friendly to the ears. If the information appears fuzzy and causes the brain to implode after two sentences, toss it away and stop listening. Doing so will make the news as orderly and simple to understand as the truth!”—In “GHG Emissions”; The Kingfisher Story Collection.</p>"
10.2139/ssrn.4894684,How Will Generative AI Impact Communication?,N/A
10.36227/techrxiv.24045792.v1,"Exploring the Synergy between Generative AI, Data and Analytics in the Modern Age","<jats:p>&lt;p&gt;In the year 2023, a heightened sense of curiosity and apprehension pervaded the landscape of generative artificial intelligence (AI), particularly in the wake of the unveiling of the ChatGPT product by OpenAI. This pivotal moment sparked a flurry of discussions that predominantly revolved around the role of data in shaping the trajectory of generative AI. As researchers and organizations alike delved into this innovative realm, a pronounced inclination toward investigating its potential applications emerged. Notably, organizations swiftly recognized the transformative potential of generative AI in bolstering productivity across various sectors.&lt;/p&gt;
&lt;p&gt;At the heart of these deliberations lies the profound significance of data. With data as the focal point, a compelling exploration began to unfold, with researchers keenly scrutinizing the ramifications of integrating generative AI within the domain of data and analytics. This research initiative was driven by an intrinsic desire to uncover the ways in which generative AI could be harnessed to enhance and streamline analytical processes.&lt;/p&gt;
&lt;p&gt;In this context, the present research undertook a comprehensive investigation, employing a multifaceted approach. Leveraging various social media platforms as a primary source of insights, the research embarked on a journey to discern the prevailing sentiments, concerns, and expectations surrounding generative AI tools. This was further complemented by the execution of proof-of-concept (POC) endeavors, which not only enabled hands-on experience with generative AI tools but also facilitated a nuanced comprehension of their practical implications.&lt;/p&gt;
&lt;p&gt;The culmination of these efforts yielded a series of noteworthy findings. Principally, it was discerned that enterprises stand to gain substantial benefits from embracing the capabilities of generative AI within the domain of data and analytics. The integration of generative AI tools offers the potential to revolutionize productivity, propelling organizations toward novel insights and expediting analytical processes. Concurrently, a strategic partnership with generative AI entities emerged as a salient consideration for safeguarding intellectual properties. Collaborative engagements between companies and generative AI providers became imperative to navigate the evolving landscape of data-driven innovation.&lt;/p&gt;
&lt;p&gt;In conclusion, the year 2023 ushered in a period marked by intense curiosity and apprehension surrounding generative AI, catalyzed by the introduction of ChatGPT and its ensuing discussions. The centrality of data within this discourse propelled researchers and organizations toward an exploration of generative AI's potential applications, notably in the realm of data and analytics. Through a comprehensive research endeavor encompassing social media insights, POC experimentation, and practical insights, it became evident that the integration of generative AI could usher in transformative enhancements to productivity and analytical processes. In parallel, collaborative endeavors with generative AI entities emerged as a strategic imperative, offering a dual advantage of innovation and intellectual property protection. This research underscores the compelling need for enterprises to harness generative AI's capabilities, thereby positioning themselves at the vanguard of data-driven progress.&lt;/p&gt;</jats:p>"
10.2139/ssrn.4553787,Competition in Generative AI Foundation Models,N/A
10.1162/99608f92.cdfc3092,Castles in the Sand?: How the Public Sector and Academia Can Partner in Regulatory Sandboxes to Help Leverage Generative AI for Public Good,N/A
10.21275/sr24604032016,"A Generative AI Framework for Enhancing Software Test Automation: Design, Implementation, and Validation",N/A
10.1007/979-8-8688-0318-5_9,Generative AI’s Benefits and Risks to Society,N/A
10.1007/979-8-8688-0403-8_7,Advanced Techniques for Large Language Models,N/A
10.1007/978-3-031-46238-2_11,Generative Adversarial Networks for Stain Normalisation in Histopathology,N/A
10.1007/s43681-024-00489-4,Human control of AI systems: from supervision to teaming,"<jats:title>Abstract</jats:title><jats:p>This article reviews two main approaches to human control of AI systems: supervisory human control and human–machine teaming. It explores how each approach defines and guides the operational interplay between human behaviour and system behaviour to ensure that AI systems are effective throughout their deployment. Specifically, the article looks at how the two approaches differ in their conceptual and practical adequacy regarding the control of AI systems based on foundation models––i.e., models trained on vast datasets, exhibiting general capabilities, and producing non-deterministic behaviour. The article focuses on examples from the defence and security domain to highlight practical challenges in terms of human control of automation in general, and AI in particular, and concludes by arguing that approaches to human control are better served by an understanding of control as the product of collaborative agency in a multi-agent system rather than of exclusive human supervision.</jats:p>"
10.18260/1-2--46433,A Custom Generative AI Chatbot as a Course Resource,N/A
10.1007/s43681-023-00319-z,Speciesist bias in AI: a reply to Arandjelović,"<jats:title>Abstract</jats:title><jats:p>The elimination of biases in artificial intelligence (AI) applications—for example biases based on race or gender—is a high priority in AI ethics. So far, however, efforts to eliminate bias have all been anthropocentric. Biases against nonhuman animals have not been considered, despite the influence AI systems can have on normalizing, increasing, or reducing the violence that is inflicted on animals, especially on farmed animals. Hence, in 2022, we published a paper in <jats:italic>AI and Ethics</jats:italic> in which we empirically investigated various examples of image recognition, word embedding, and language models, with the aim of testing whether they perpetuate speciesist biases. A critical response has appeared in <jats:italic>AI and Ethics</jats:italic>, accusing us of drawing upon theological arguments, having a naive anti-speciesist mindset, and making mistakes in our empirical analyses. We show that these claims are misleading.</jats:p>"
10.1007/s43681-023-00417-y,TAI-PRM: trustworthy AI—project risk management framework towards Industry 5.0,"<jats:title>Abstract</jats:title><jats:p>Artificial Intelligence (AI) is increasingly being used in manufacturing to automate tasks and process data, leading to what has been termed Industry. 4.0. However, as we move towards Industry 5.0, there is a need to incorporate societal and human-centric dimensions into the development and deployment of AI software artefacts. This requires blending ethical considerations with existing practices and standards. To address this need, the TAI-PRM framework has been developed. It builds upon established methods, such as Failure Mode and Effect Analysis (FMEA) and the Industrial ISO 31000, to manage risks associated with AI artefacts in the manufacturing sector. The framework identifies ethical considerations as hazards that can impact system processes and sustainability and provides tools and metrics to manage these risks. To validate the framework, it was applied in an EU project for Digital Twins on AI for manufacturing. The results showed that TAI-PRM can effectively identify and track different failure modes associated with AI artefacts and help users to manage ethical risks associated with their deployment. By incorporating ethical considerations into risk management processes, the framework enables the developing and deploying trustworthy AI in the manufacturing sector.</jats:p>"
10.1007/s43681-021-00075-y,The ethical AI—paradox: why better technology needs more and not less human responsibility,N/A
10.4324/9781003507949-2,Pedagogical Foundations of AI Integration,N/A
10.2139/ssrn.4511540,"Large Language Models and Generative AI in Finance: An Analysis of ChatGPT, Bard, and Bing AI",N/A
10.46397/jaih.14.3,Ethical Problems of Super-Massive Generative AI,N/A
10.46397/jaih.15.6,Generative AI Products and Copyright Issues,N/A
10.1007/978-1-4842-9367-6_9,The Future,N/A
10.1007/s43681-023-00358-6,"Elusive technologies, elusive responsibilities: on the perceived responsibility of basic AI researchers","<jats:title>Abstract</jats:title><jats:p>This paper studies how researchers who work in the field of basic research of artificial intelligence (AI) perceive their responsibility. A case study is conducted on an inter-university and interdisciplinary research cluster in Germany that specializes in basic artificial intelligence research. The reason for studying responsibility through the lens of such researchers is that working in basic research of AI involves a lot of uncertainty about potential consequences, more so than in other domains of AI development. After conducting focus groups with 21 respondents followed by a thematic analysis, results show that respondents restrict the boundaries of their sociotechnical visions, regard time as an influencing factor in their responsibility, and refer to many other players in the field. These themes indicate that respondents had difficulties explaining what they consider themselves responsible for, and referred to many factors beyond their own control. The only type of responsibility that was explicitly acknowledged by respondents is <jats:italic>ex ante</jats:italic> responsibility. Respondents define their responsibility in terms of things that are in their immediate control, i.e., responsibilities relating to their role and duties as researchers. According to the respondents, working in the field of basic research makes it difficult to make claims about <jats:italic>ex post</jats:italic> responsibility. Findings of this case study suggest the need to raise questions about how technological maturity is related to AI ethics.</jats:p>"
10.1007/s43681-024-00476-9,The obscure politics of artificial intelligence: a Marxian socio-technical critique of the AI alignment problem thesis,"<jats:title>Abstract</jats:title><jats:p>There is a growing feeling that artificial intelligence (AI) is getting out of control. Many AI experts worldwide stress that great care must be taken on the so-called <jats:italic>alignment problem</jats:italic>, broadly understood as the challenge of developing AIs whose actions are in line with human values and goals. The story goes that ever more powerful AI systems are escaping human control and might soon operate in a manner that is no longer guided by human purposes. This is what we call the <jats:italic>AI-out-of-control discourse</jats:italic> which, in this paper, we critically examine and debunk. Drawing on complementary insights from political theory, socio-technical studies and Marxian political economy, we critique the supposed animistic and autonomous nature of AI, and the myth of the uncontrollability of AI. The problem is not that humanity has lost control over AI, but that only a minority of powerful stakeholders are controlling its creation and diffusion, through politically undemocratic processes of decision-making. In these terms, we reframe the alignment problem thesis with an emphasis on citizen engagement and public political participation. We shed light on the existing politics of AI and contemplate alternative political expressions whereby citizens steer AI development or stop it in the first place.</jats:p>"
10.1007/s43681-023-00333-1,Lustre and shadows: unveiling the gaps in South African University plagiarism policies amidst the emergence of AI-generated content,"<jats:title>Abstract</jats:title><jats:p>In recent years, artificial intelligence (AI) has become a key technology in the field of academic integrity. However, there is a lack of a comprehensive understanding of the legal dimensions of plagiarism in the context of AI. In this study, a theoretical framework that combines the social construction of technology and the legal dimension of plagiarism was used to explore the current construction of plagiarism in South African university plagiarism policies. This study aims to highlight the inadequacy of current plagiarism policies, which primarily focus on the act of copying from others and emphasize the need for a broader perspective that addresses the challenges posed by artificial intelligence in academic integrity in the era of AI-generated content. The author used confirming sampling and data saturation was reached with a sample of ten university plagiarism policies. The findings revealed an inadequacy of the policies on the coverage of AI-generated content and therefore justifying the need to redefine plagiarism in the context of the artificial intelligence revolution. The author concludes by redefining plagiarism and justifying the utility of the recommended definition.</jats:p>"
10.1007/s43681-024-00544-0,Advising AI assistant: ethical risks of Oura smart ring,N/A
10.1201/9781003359982-6,"AI, Peace, and Ethics",N/A
10.1093/oxfordhb/9780190067397.013.18,AI as a Moral Right-Holder,"<p>This chapter evaluates whether AI systems are or will be rights-holders. It develops a skeptical stance toward the idea that current forms of artificial intelligence are holders of moral rights, beginning with an articulation of one of the most prominent and most plausible theories of moral rights: the Interest Theory of rights. On the Interest Theory, AI systems will be rights-holders only if they have interests or a well-being. Current AI systems are not bearers of well-being, and so fail to meet the necessary condition for being rights-holders. This argument is robust against a range of different objections. However, the chapter also shows why difficulties in assessing whether future AI systems might have interests or be bearers of well-being—and so be rights-holders—raise difficult ethical challenges for certain developments in AI.</p>"
10.1007/978-3-031-23035-6_3,Practical Implications of Different Theoretical Approaches to AI Ethics,<jats:title>Abstract</jats:title><jats:p>Ethics are moral principles that govern a person’s behaviour or the conduct of an activity.</jats:p>
10.2139/ssrn.4523551,Talkin’ ‘Bout AI Generation: Copyright and the Generative AI Supply Chain,N/A
10.1007/979-8-8688-0205-8_4,Guardrails and AI: Building Safe + Controllable Apps,N/A
10.4018/979-8-3693-5578-7.ch009,AI in Marketing,"<jats:p>In recent times, artificial intelligence (AI) has become an essential component in marketing, leading to the generation of large amounts of data and information, as well as advancements in management software and algorithms. The goal of artificial intelligence is to intelligently imitate human behavior. Artificial intelligence is a rapidly expanding technology, industry, and field of study. AI not only enhances existing marketing strategies, but also introduces innovative ways to deliver value to customers. AI also plays an important role in helping marketers manage marketing projects, support them, create content, and perform other tasks. Research shows that a lack of understanding of AI's capabilities and failed implementation efforts can create additional obstacles for organizations, including investment risks, ethical dilemmas, data issues, recruitment challenges, and negative environmental impacts. Despite being designed to reduce the workload of employees, human intervention is necessary in roles such as management, supervision, and innovation.</jats:p>"
10.1093/oso/9780198876434.003.0019,Is AI Ethics All Fluff?,"<jats:title>Abstract</jats:title>
               <jats:p>The AI revolution provides a neat illustration of C.P. Snow’s point about the “two cultures” and a timely opportunity to reflect on why a cultural gap between the sciences and humanities persists. This chapter takes aim at an attitude prevailing among some computer scientists that ethics and AI ethics, as branches of the humanities, are unserious disciplines because they do not yield verifiable and quantifiable answers to the problems they address.</jats:p>"
10.1093/oxfordhb/9780190067397.013.6,The Incompatible Incentives of Private-Sector AI,"<p>This chapter evaluates the incompatible incentives of private-sector AI. Private-sector investment in AI is dominated by major internet platform companies such as Facebook, Amazon, Apple, Google, and Microsoft. These platform companies are also leaders in deploying deep learning algorithms. Although deep learning algorithms may be more intelligent than previous generations of machine learning, they are not more robust. There may be a faint technical path forward for problems of bias and unfairness, but algorithms are engines, and pervasive incompatible incentives will remain. As such, algorithms require guardrails. However, technology companies are ill-suited and ill-positioned to design or implement these value-based rules. Guardrails become constraints on people’s behavior, and yet, in cases of high elasticity, effective governance may still be elusive. Ultimately, the pairing of the algorithm and guardrails tempts companies to engage in regulatory arbitrage, providing a requirement for external action.</p>"
10.1007/s43681-022-00145-9,FMEA-AI: AI fairness impact assessment using failure mode and effects analysis,N/A
10.1007/s00146-023-01761-7,Reimagining Benin Bronzes using generative adversarial networks,N/A
10.1007/s43681-023-00264-x,Ought we align the values of artificial moral agents?,N/A
10.1007/979-8-8688-0456-4_9,The AI Gold Rush and the Future of Business,N/A
